{
  "$schema": "https://raw.githubusercontent.com/just-awesome-games/capsule-engine/main/schemas/sheet.schema.json",
  "formatVersion": 1,
  "texture": "textures/traps/spikes.png",
  "boxes": [
    {
      "name": "spikes"
    }
  ],
  "frames": [
    {
      "name": "down",
      "x": 0,
      "y": 0,
      "width": 16,
      "height": 8
    },
    {
      "name": "rising",
      "x": 16,
      "y": 0,
      "width": 16,
      "height": 8,
      "boxes": {
        "spikes": {
          "x": 1,
          "y": 3,
          "width": 14,
          "height": 3
        }
      }
    },
    {
      "name": "up",
      "x": 32,
      "y": 0,
      "width": 16,
      "height": 8,
      "boxes": {
        "spikes": {
          "x": 1,
          "y": 0,
          "width": 14,
          "height": 6
        }
      }
    }
  ],
  "clips": [
    {
      "name": "cycle",
      "loop": true,
      "frames": [
        {
          "frame": "down",
          "ticks": 90
        },
        {
          "frame": "rising",
          "ticks": 4
        },
        {
          "frame": "up",
          "ticks": 60
        },
        {
          "frame": "rising",
          "ticks": 4
        }
      ]
    }
  ]
}
