{
  "formatVersion": 1,
  "texture": "walker.png",
  "frames": [
    { "name": "walk-0", "x": 0, "y": 0, "width": 16, "height": 24 },
    { "name": "walk-1", "x": 16, "y": 0, "width": 16, "height": 24 },
    { "name": "walk-2", "x": 32, "y": 0, "width": 16, "height": 24 },
    { "name": "walk-3", "x": 48, "y": 0, "width": 16, "height": 24 }
  ],
  "clips": [
    {
      "name": "walk",
      "loop": true,
      "frames": [
        { "frame": "walk-0", "ticks": 4 },
        { "frame": "walk-1", "ticks": 4 },
        { "frame": "walk-2", "ticks": 4 },
        { "frame": "walk-3", "ticks": 4 }
      ]
    }
  ]
}
